id,user,tweets,date,location,favorites,retweets,english,polarity,Expression Label
1394568938726563844,MglPurevdorj,Энхбат гуай интернэт анх оруулж ирсэн тул шүт мөргө гээд байдаг хүмүүс үүнийг нэг уншина биз ээ https://t.co/IErQm8GhfO,2021-05-18 08:21:59,,3,0,"Since Enkhbat guai was the first to introduce the internet, people who worship him will probably read it https://t.co/IErQm8GhfO",1.0,positive
1394247847722164227,gantulg75803815,@KhishigtogtohTs Энэ Д. Энхбат гуайг харлуулах гэсэн зохион байгуулалттай жиргээ байнаа. 🤣😂🤣. Тэднийг дэмжигчид хэзээ ч ингэхгүй нь тодорхой,2021-05-17 11:06:05,Engineer,3,0,"@KhishigtogtohTs This D. There is an organized tweet to blacken Enkhbat guai. 🤣😂🤣. Obviously, their supporters will never do that",-0.2,neutral
1394305857471479811,ebaatar56,ХҮН-аас ерөнхийлөгчид нэр дэвшиж байгаа Энхбат: ШУ-ны салбараа хөгжүүлэх нь тэргүүн зэргийн зорилт. Үүний тулд багш нарын цалинг гурав дахин нэмэгдүүлэх. Ингэж байж монгол улс хөгжинө гээд байна. https://t.co/dmb706vr47,2021-05-17 14:56:36,"Ulaanbaatar, Mongolia",3,1,"Enkhbat, a candidate for the presidency from the People&#39;s Republic of China: Developing the science sector is a priority. To do this, triple teachers&#39; salaries. This is how Mongolia will develop. https://t.co/dmb706vr47",0.6,positive
1393111607744552963,ZoljargalB,Аль ч талбарт 20/80 гэсэн зарчим үйлчилдэг гэдгийг надаар хэлүүлэлтгүй мэдэж л байгаа байх. Д.Энхбат гуай 20 хувьд (Монголд үнэндээ 5% хүрвэл их юм) чиглэсэн кампанит ажил хийж байгаа бол сонгогдохгүй нь тодорхой болсон юм байна. Зорилго нь тэгэхээр Ерөнхийлөгч болох биш байна https://t.co/5vTgJvw5nI,2021-05-14 07:51:04,"Улаанбаатар хот, Монгол улс",3,0,"You know without me that the 20/80 principle applies in any field. It has become clear that D. Enkhbat will not be elected if he is campaigning for 20 percent (in fact, it is 5% in Mongolia). The goal is not to become President https://t.co/5vTgJvw5nI",-1.0,negative
1394572399014825984,Arhaa_0505,Энхбат чинь нүдээ цавчихгүй худал ярьдаг хүн юм бишүү https://t.co/dUzfez0rEB,2021-05-18 08:35:44,,3,2,Enkhbat is not a liar without closing his eyes https://t.co/dUzfez0rEB,-1.0,negative
1395321941116940288,Zoljargal2111,"Энэ жил Д.Энхбат гуай гарахгүй байсан ч хамаагүй, энэ хүнд саналаа өгнө. https://t.co/W7uAmsmK1t",2021-05-20 10:14:09,,3,2,"Even if D.Enkhbat does not come out this year, he will vote for this person. https://t.co/W7uAmsmK1t",1.0,positive
1395302415029657601,idevkhtei_irgen,"@Uyanga_ts Хүрэлсүх гарах нь гэж гуниглаж эмоорч байхын оронд Д.Энхбат гараасай гэж зүтгэж суух нь хэд дахин илүү үр бүтээлиэй, эерэг байна л 🙂...",2021-05-20 08:56:33,Улаанбаатар. Монгол Улс,3,1,"@Uyanga_ts Instead of being sad and afraid that Khurelsukh will leave, it is much more productive and positive for D.Enkhbat to work hard 🙂 ...",1.0,positive
1393535979642703877,Battogtohoo,"Энхбат маань яагаад элит, сэхээтэн биш болчхов? Угаасаа дэмжигчдийн ихэнх нь ""орк биш"" гэдэг үндэслэлээр бас сэхээтнийг сонгосон гэдэг validation авах гэж дэмжиж бга биздэ? Мань хүнд ч угаасаа үүнээс өөр бүрдүүлээд бх имиж бхгүй юм чинь энэ тодорхойлолтоос зугтах шаардлага бн уу?",2021-05-15 11:57:22,,3,2,"Why is Enkhbat no longer an elite or an intellectual? In fact, most of the supporters support the idea of choosing an intellectual on the grounds that they are not &quot;orcs&quot;. Is it necessary for this person to avoid this definition because he does not have any other image?",-1.0,negative
1394396701289549827,bileedmn,Энхбат гуайг дэмжиж байгаа бол хөдөө байдаг 2 хүнрүү залгаж яриад яагаад гэдгийгээ ойлгуулчих хэрэгтэй шүү хүмүүсээ!,2021-05-17 20:57:34,"Ulaanbaatar, Mongolia",3,1,"If you support Enkhbat guai, you need to call two people in the countryside and explain why!",-1.0,negative
1393034220163919877,burmaa999,"@erdenebatavia Эсрэгээрээ байгаа даа уг нь. Энхбат гуайг дэмжсэн хүмүүсийн бичсэн зүйлс дотроос ингэлээ тэглээ, ингэж харьцууллаа гэсэн юм олж муулах тактик, чиглэл олж авсан гэж ойлгосон. Бараг л  хүн бүр л команд авсан юм шиг зэрэг зэрэг гомдоллоод эхэлж байна.",2021-05-14 02:43:34,Mongolia,3,0,"@erdenebatavia On the contrary. From the writings of those who supported Enkhbat guai, I understood that they had found tactics and directions to find such and such comparisons. Almost everyone is complaining at the same time as if they have received a command.",-0.2,neutral
1393605050216243203,MandalVariety,@ODELelectronics Бүгд л тэр үед наймаагаа хийж байсан. Интернетийг оруулж ирэх боломж байсан ч хэн ч хийгээгүй. Энхбат л хийсэн.,2021-05-15 16:31:50,Mongolia,3,0,"@ODELelectronics Everyone was trading at the time. There was an opportunity to bring in the Internet, but no one did. Enkhbat did it.",-1.0,negative
1395284956381810691,Nandin991,Энхбат начин ухаан орлоо гдг мэдээг сэвсний маргааш Түвшинбаяр суллагдаж нтр,2021-05-20 07:47:11,,3,0,Tuvshinbayar was released the next day after receiving word that Enkhbat had regained consciousness,1.0,positive
1393582643850121221,Uugi78,Эрдэнэбилэгийн Энхбат маань гайгүй байгаасай🙏🙏🙏,2021-05-15 15:02:48,Arlington VA,3,1,I wish Erdenebileg Enkhbat to be fine🙏🙏🙏,1.0,positive
1393723091457437700,batdorj911,"Хэлээд л байгаа шүү Хүрэлсүх ялах аваас дарангуйлал тогтоно шүү. Эрдэнээ ч олигтой сонголт биш, Энхбат ялахгүй. Тэгэхээр цагаан сонголт хийж шинэ нэр дэвшигчтэй сонгууль хийе ! https://t.co/TFPOyQziq9",2021-05-16 00:20:53,,3,1,"I am saying that if Khurelsukh wins, the dictatorship will be established. Erdene is not a good choice, Enkhbat will not win. So make a white choice and vote with a new candidate! https://t.co/TFPOyQqiz9",-0.5,negative
1393040882492874755,anaraaaad,"@Batka_ Өөрсдийгөө элит гэж боддог бүлэг бдаг 😂 тэрэнд өөрөө багтахаас🤣!
 Энхбат гуай бол биш юм аа...",2021-05-14 03:10:02,Mongolia,3,0,@Batka_ There is a group that thinks they are elite 😂 Enkhbat guai is not ...,-1.0,negative
1394613731871510531,erdene457,"Жин тоник гэдэг эмэгтэй акк-г худалдаж авсан нөхөр их улстөржиж Элбэгээг харааж зүхэж, Эрдэнэ Энхбат хоёр руу дайрч харагдах юм",2021-05-18 11:19:59,Улаанбаатар,3,0,"A woman named Jin Tonik, the husband who bought the ACK, became very politicized, cursed Elbeg and attacked Erdene Enkhbat.",-1.0,negative
1395195791975854085,ulziisaikhan_ts,@Uyanga_ts Энхбат гуай гарахгүй ээ.Би анхнаасаа л хэлээд байгаа ишлэлээр дээшээ гардаг бол Монгол улс хөгжөөд тасарчихсан тэр чинь зүгээр л ...,2021-05-20 01:52:52,Монгол улс Дорнод аймаг ,3,2,@Uyanga_ts Enkhbat guai will not come out.,-1.0,negative
1395269552527880193,bzbten,"Энхбат у/төрийн системийн гажгийг оношлочихсон. Намын дотоод ардчилалыг хангахгүйгээр улс орон хөгжихгүй гдг,үүнд ч би итгэдэг. Гэтэл Эрдэнэ гэгч намынха сунгааг 100 саяаар үнэлж УИХ сонгуульд ялагдуулсан. Нам дотро ардчилал хж чадаагүй хүн улс орны ардчилалыг хамгаална гэнээ 🤣",2021-05-20 06:45:58,,3,1,"Enkhbat has been diagnosed with anomalies in the state system. I believe that a country cannot develop without ensuring internal party democracy. However, Erdene&#39;s party was valued at 100 million and lost the parliamentary election. It is said that a person who fails to develop democracy within the party will protect the country&#39;s democracy",-1.0,negative
1394648237823324160,idevkhtei_irgen,"@MBBontoi Дуртайяа 😃 

Д. Энхбат гуай Ерөнхийлөгч болвол аштай юу даа 👍... 

Нэээг Хоёрыын Гурвааа! гээд түрэх хүчинд нь дусал нэмэр болоё оо. Амжилт! ✌️",2021-05-18 13:37:05,Улаанбаатар. Монгол Улс,3,3,@MBBontoi Дуртайяа 😃 Д. Is it profitable for Enkhbat guai to become the President 👍 ... Three of the two! Let&#39;s add a drop to the push. Good luck! ✌️,0.7,positive
1394651059042152450,Tsetsensaid,Д.Энхбат: Би нэг зүйлд их санаа зовж байна. Монголын ардчилал үнэхээр нэг намын дарангуйллаар солигдох вий гэхээс айж байна https://t.co/k2gSOb2iRk via @https://dnn.mn,2021-05-18 13:48:18,,3,2,D.Enkhbat: I am very worried about one thing. I am afraid that Mongolia&#39;s democracy will be replaced by a one-party dictatorship https://t.co/k2gSOb2iRk via @https: //dnn.mn,-1.0,negative
1394544678700191745,otgonotgo,"Интернэт Энхбат оруулаагүй гээд бгаа хүмүүст хэлэхэд тэр үед IT-ын мэргэжлийг сайн эзэмшсэн, компани аваад явчих чадалтай хүмүүс ховор бсан шүү. https://t.co/nNC9oH7j9I",2021-05-18 06:45:35,,3,0,"When I told people that Enkhbat was not included in the Internet, at that time there were very few people who were well versed in IT and could take a company. https://t.co/nNC9oH7j9I",0.0,neutral
1394278135886086145,ODELelectronics,@bolorurtnasan Интернетийг Энхбат хийгээгүй бол хэн нэгэн хийнэ гэдэгт хариу бичсэн юмаа😀😀😛😛,2021-05-17 13:06:26,"Ulaanbaatar, Mongolia",3,0,"@bolorurtnasan If Enkhbat didn&#39;t make the internet, someone will do it😀😀😛😛",-1.0,negative
1393577707183558663,NominooU,Миний сонголт #Энхбат https://t.co/Axi8itXsJs,2021-05-15 14:43:11,,3,0,My choice #Enkhbat https://t.co/Axi8itXsJs,1.0,positive
1394267857156927497,Msaikhan122,@Mandukhai_ Ер нь бол интернетийн хөгжил Монголын хилийг зад цохиод ороод ирсэн л дээ.Тэрийг нь л Энхбат гуай түрүүлж олж харсан гж бддог.30онд бид бөмбөг гж юмыг мэдэхгүй шахуу бхад хөл бөмбөгийн дэлхийн аварга болж бсан биздээ кккккк,2021-05-17 12:25:36,,3,0,"@Mandukhai_ In general, the development of the Internet has penetrated the Mongolian border. It seems that Enkhbat guai saw it first.",-1.0,negative
1395238701278498817,EvaaveB,"Жагаа ах - за битгий санаа зов доо тэр Эрдэнээ чинь гарахгүй дэ  , Энхбат чинь бүүр гарахгүй  гж авсанн Хүк нь л гархым бх даа 😢",2021-05-20 04:43:23,,3,2,"Brother Jagaa - don&#39;t worry, Erdene won&#39;t come out, Enkhbat won&#39;t come out at all, Huk is the only one left 😢",-1.0,negative
1394805812388786179,Mongol_huu,МН25-ийн Алтай Багабандийнхаа зараалаар Хүүкийг дэмжих ёстой учраас гоншигоносон Буян Жагааг зориуд Д.Энхбат гуайн араас гаргаж байгаа юм. https://t.co/UlMTNEPc6m,2021-05-19 00:03:14,"Ulaanbaatar, Mongolia",3,6,"Buyan Jagaa, who murmured that he should support Hook at the behest of MN25&#39;s Altai Bagabandi, is being deliberately pursued by D.Enkhbat. https://t.co/UlMTNEPc6m",-0.1,neutral
1393564583088906246,sogoomn,Энхбат нэр дэвшигч мөнгө цацахгүй байгаамаа даа,2021-05-15 13:51:02,Mongolia,3,0,Candidate Enkhbat is not spending money,-1.0,negative
1394968348283318272,sh_buya,"Э.Энхбат начин ухаан оржээ, схан мэдээ гээд хүмс баярлах, үнэхээр баярлах схан мэдээ! 
Монгол Төрд ухаан оржээ гэсэн схан мэдээ хэзээ ирэх бол! 
100 жил элбэг бгаа гэж бодхоос дотор харанхуйлах!!!!",2021-05-19 10:49:06,,3,0,"E.Enkhbat has come to his senses, people are happy about the news, they are really happy news! When will the news that the Mongolian government has come to its senses come? It&#39;s darker than you think 100 years is enough !!!!",0.1,neutral
1394148804413169668,KhulanMi,"@Teshka1231 Энхбат Хүүк гсн ривал болоод бна өө, Эрднээг тоож бга, яриж бга хүн бтугай 🐕 ч алга гэшш ккк",2021-05-17 04:32:31,Mongolia,3,0,@ Teshka1231 Enkhbat Hook has become a rival,-1.0,negative
1393837596506148866,Dandag_5004,@KhulanMi Энхбат гуайд дээл ч зохихгүй бх үнэндээ,2021-05-16 07:55:53,Mongolia,3,0,"@KhulanMi In fact, Enkhbat doesn&#39;t deserve a deel",-1.0,negative
1394197934024003587,SerteeO,"@Mandukhai_ Хэн нэгэн хийх л ажил байсан.
Д.Энхбат гуай анхлан хийжээ.",2021-05-17 07:47:45,Mongolia,3,0,@Mandukhai_ It was just someone&#39;s job. D.Enkhbat guai did it first.,-0.5,negative
1394876138732756992,TsegmidS,"@enheene @Orgil0723 Эрхэм нэр дэвшигч Дангаасүрэнгийн ЭНХБАТ-ын хувьд ялсан ч, ялагдсан ч адил байх. Ялвал улс орноо зөв хөгжил цэцэглэлтийн зөв гольдролд чиглүүлнэ. Ялагдвал өөрийн бизнесийг хөгжүүлнэ.",2021-05-19 04:42:41,,3,2,"@enheene @ Orgil0723 Dear candidate Dangaasuren Enkhbat, it is the same whether he wins or loses. Victory will lead the country in the right direction of prosperity. If you lose, you will grow your business.",0.8,positive
1392844038043181056,ChuluunpurevS,@Chuluunbat201 Жиргээнд бас сонин юм их бх юм огт харилцаж үзээгүй мөртөө блоклуулсан хэдэн хүн бий. Энхбат бас Бодонгууд билүү аялдаг нөхөр бн. Баабар гуай бол согтуудаа миний жиргэснийг буруу ойлгоод блок хсн бх гэж боддог буруутгаж чаддаггүй юм. Энхбатын блокнд бол хэлмэгдсэн мэдрэмж төрөөд,2021-05-13 14:07:51,,3,0,"@ Chuluunbat201 There are also a few people on Twitter who have never communicated, but have been blocked. Enkhbat is also a Bodonguud traveling companion. Baabar guai can&#39;t blame his drunks for misunderstanding my tweet and thinking that he wants to block everything. In Enkhbat&#39;s bloc, there was a feeling of repression",-0.8,negative
1394880440402546688,tulgach2,@DanzanBolormaa @batmagnaib Д.Энхбат гуайг дэмжиж байгаа ч Ерөнхийлөгч болгоод яг юу хийх үү? Засаг төрд олонхоороо гарчихсан хүмүүс юм хийлгүүлэх үү? Х.Баттулга шиг зүгээр л нэр зүүсэн нэр хүндгүй Ерөнхийлөгч болох юм биш үү? Х.Баттулга хууль санаачлаад зарлиг гаргаад нэг нь ч батлагдаагүй хэрэгжээгүй.,2021-05-19 04:59:47,,3,1,"@DanzanBolormaa @batmagnaib I support D.Enkhbat, but what exactly will I do as President? Will the people who are in the majority in the government get things done? Isn&#39;t he going to become an infamous President just like Kh. Battulga? Kh. Battulga initiated the law and issued a decree, none of which was approved and implemented.",-0.6,negative
1394157581279584260,SBBONTOI,@enkhtemuulen @enkhbat Бусдад боломж байгаагүй гэдгийг яг тэр үед АНУ-д байсан хүний хувьд мэднэ. Энхбат америкчуудыг ятгаж чадсан ганц хүн гэж бодож байна. Магадгүй 3-4 жилийн хойно боломж гарах байсан байх. Гэхдээ мэдээллийн технологийн салбарт 3-4 жил алдана гэдэг том хохирол.,2021-05-17 05:07:24,Mongolia,3,3,"@enkhtemuulen @enkhbat As someone who was in the United States at the time, I know that others didn&#39;t have the opportunity. I think Enkhbat was the only person who managed to persuade the Americans. Maybe in 3-4 years there will be an opportunity. But losing 3-4 years in the information technology sector is a big loss.",-0.9,negative
1395035840246550539,zaluu88,"@IREEDUIRUU @enkheeontweet @Uyanga_ts Энхбат гуай УБ+Дархан+Эрдэнэт 3хотыг гол тулгуур болгоод бүх хүчээ хаях хэрэгтэй, орон нутагийг хаях хэрэгтэй.",2021-05-19 15:17:17,"Buenos Aires, Argentina",3,0,"@IREEDUIRUU @enkheeontweet @Uyanga_ts Enkhbat guai UB + Darkhan + Erdenet 3 cities should be the mainstay and all efforts should be made, the countryside should be abandoned.",-1.0,negative
1394923385080082433,bjargal9999,7.1 ний дараа Д.Энхбат Б.Жаргалсайхан нар бултсан мэлзсэн.Батзандан сууж гарч ирээд нүд нь гөлөгнөөд бууж өгсөн амиа авч гарах арга хайж байсан.Харин О.Магнай түрдэг тэргэн дээр суучихсан бие нь тааруу хэрнээ нүд нь гялалзаад цогтой хэлэх гэснээ хэлж байсан.Түүх халуунаараа бгаа,2021-05-19 07:50:26,,3,1,"After 7.1, D.Enkhbat and B.Jargalsaikhan escaped. Batzandan came out with a shot in the eye and was looking for a way to save his life. History is hot",0.6,positive
1393940954550177793,Suvdok,"Ингэж бичнэ гэж чиглэл авсан 
юм уу Энхбат гуай хийдэггүй болоод 5,6 компанитай болох уу? Санхүүгийн эрх чөлөөгөө өөрөө олж авсан болхоос энэ хоёр шиг улсын төсөвөөс тэрбумтан болоогүй л байх. https://t.co/oPpSl9tpXI",2021-05-16 14:46:36,"UB , Mongolia.",3,1,"Did Enkhbat guai get a direction to write like this or will he have 5.6 companies because he doesn&#39;t do it? He probably didn&#39;t become a billionaire from the state budget like these two, because he gained his financial freedom himself. https://t.co/oPpSl9tpXI",-0.3,neutral
1393408333525123074,myagmardorj_,"@110Orgio @enkhbat Би бол ямар ч бичлэг гарч ирсэн Д.Энхбат бол яг энэ удаагийн “ийм” нөхцөл байдалд болж буй сонгуульд С.Эрдэнэ, У.Хүрэлсүх нараас “дээр” сонголт бна гэж хувьдаа бодож бгаа. Тийм болохоор л ийм эрт ийм итгэлтэйгээр сонголтоо зарлаад бгаа :)",2021-05-15 03:30:09,Ulaanbaatar,3,1,"@ 110Orgio @enkhbat I personally think that D.Enkhbat, who came up with any video, will have a “better” choice than S.Erdene and U.Khurelsukh in the current election. That&#39;s why I announced my choice so early and so confidently :)",1.0,positive
1393885492840583168,enkhlen_n,Д.Энхбат: Үргэлж суралцахыг дадал зуршлаа болго https://t.co/6lVBBuQpIS,2021-05-16 11:06:13,,3,2,D.Enkhbat: Make it a habit to always learn https://t.co/6lVBBuQpIS,1.0,positive
1393889243663982595,Onon3000,"@batengineer @serdenemn энхбат аль аль бишээ Монголд ганцхан фашист хүн байгаа, эрдэнэ гуайг хүртэл алах тухай хэлсэн.
Монголд цус гаргахыг хүсээд байдаг цөөхөн хэд л хүн бий",2021-05-16 11:21:07,,3,0,"@batengineer @serdenemn neither Enkhbat said that there is only one fascist in Mongolia, even Erdene guai. There are very few people in Mongolia who want to bleed",-1.0,negative
1392882554093506560,Ogi_Bavaria,Д.Энхбат гуайн хандивын аргаихэмжээ сэтгэл хөдлөс болж бншүү 🥰,2021-05-13 16:40:54,,3,0,D.Enkhbat&#39;s donation method is very emotional 🥰,1.0,positive
1393424732658171908,Zandaa_G,"Энхбат ч дээ...
#ТөлбөртэйЖиргээ",2021-05-15 04:35:19,,3,4,Enkhbat too ... # PaidJirgee,1.0,positive
1392875784671350785,Dandag_5004,@artanyan @nambon__ Танайхны пиар чинь Дарангуйлагч гэж нэг үзээд бүдүүлэгүүд хүүкийн тал сэхээтэн бол энхбат гэсэн уриатайн бишүү,2021-05-13 16:14:00,Mongolia,3,0,"@artanyan @nambon__ Your family&#39;s PR is considered to be a dictator, and rude people are half-intellectuals.",-1.0,negative
1393420717522243586,TuvshinjargalZ,"@Aanxaa Энхбат гуай бол дэндүү бөөрөнхий, гутранги, саарал хүн шүү дай",2021-05-15 04:19:22,Mongolia,3,0,"@Aanxaa Enkhbat guai is too round, pessimistic and gray",-1.0,negative
1394231494961340429,ganbaatar_b8,"@Uyanga_ts Ямар ч байсан ардчиллыг наймаацалгүй аваад үлдсэн хүн. Хэн нэгэн шиг шоронгийн сургаар бууж өгч нус нулимсандаа хүрээгүй. Хүмүүс урваж байхад ажраагүй. Дайнаар яривал галын шугамнаасаа алхам ч ухраагүй дарга. Хүүк, Энхбат гараг, Эрдэнэ унаг. Гэхдээ би энэ окопондоо үлднээ.",2021-05-17 10:01:06,,3,2,"@Uyanga_ts Anyway, he took democracy without bargaining. He did not shed any tears after giving up the prison rumor like someone else. He didn&#39;t care when people betrayed him. Speaking of war, he is a leader who has not taken a step back from the line of fire. Hook, Enkhbat planet, Erdene unag. But I will stay in this trench.",-0.1,neutral
1395026083272040453,Laperleperle,"@Uyanga_ts @IREEDUIRUU шударга, санал луйвардахгүй бол Энхбат гарна. Харин угаасаа гд луйвардвал Хүрэлсүх гарна. Гэхдээ Монголчууд сүйрнэ. 1 хүний дарангуйлалд орно.",2021-05-19 14:38:31,Mongolia,3,2,"@Uyanga_ts @IREEDUIRUU If you are honest and don&#39;t cheat, Enkhbat will come out. But if you cheat, you will get Khurelsukh. But the Mongols will perish. It is oppressed by one person.",-1.0,negative
1395023686130749444,Tuuguu67622493,"@Batka_ Хүүк 60%, Энхбат 25%, Эрдэнэ 15%",2021-05-19 14:28:59,,3,0,"@Batka_ Hook 60%, Enkhbat 25%, Erdene 15%",1.0,positive
1392876113156665344,Ganchuluun_T,@artanyan @nambon__ Мэр сэр байгаад байна шүү хө Энхбат гуайг сайн мэдэхгүй гэж хэлэнгүүт боловсролгүй сэхээтэн залуус бүгд мэдэж байгаа гээд байхийн яахуу?🙄🙄🙄,2021-05-13 16:15:18,Mongolia,3,0,"@artanyan @nambon__ The mayor is awake. When he said that he didn&#39;t know Enkhbat well, all the uneducated intellectuals said they knew him??",-1.0,negative
1393900430959157249,OilooSM,"Хэрэлддэг нь С.Эрдэнэ
Хийдэг нь Н.Алтанхуяг
Хэлдэг нь Д.Энхбат.

Даанч энд Н.Алтанхуягийн зураг энд алга. https://t.co/0Xf49CAaZe",2021-05-16 12:05:34,Ulaanbaatar,3,4,S.Erdene who quarrels N.Altankhuyag who does what D.Enkhbat says. But N.Altankhuyag&#39;s picture is not here. https://t.co/0Xf49CAaZe,-0.1,neutral
1394868970411360260,soyolmaa_g,@bambgar19 Их сайхан мэдээ дуулгадаг сайн хүүхэд байна. За хурдан эдгэрэх болтугай Энхбат начин.,2021-05-19 04:14:12,Ulaanbaatar Mongolia,3,0,"@ bambgar19 There is a good boy who tells great news. Well, let&#39;s get well soon, Enkhbat.",1.0,positive
