id,user,tweets,date,location,favorites,retweets,english,polarity,Expression Label
1392875225247674370,Amarbold881,@SoyomboMN Ай даа амлах амархан шүү. Д.Энхбат гуайг үүл рүү хөөргөчих вий гэж айх юм. Уул нь болдог бол данс руу мөнгө ороол хундгаа тулгадаг бол...,2021-05-13 16:11:46,,2,0,"@SoyomboMN Oh, it&#39;s easy to promise. I am afraid that D.Enkhbat guai will be blown to the clouds. In fact, if you put money in the account and force the drink ...",-0.3,neutral
1395318196324892675,morituimpex,@abaa_99 Энэ бол явуулгатай үйл ажиллагаа. Энхбат аягүй бол Хүкийг  арчаад өнгөрөх нь тодорхой.болонгуут алдаагаа засах магадлалтаф,2021-05-20 09:59:16,UB,2,0,@ abaa_99 This is a mobile operation. It is clear that Enkhbat will probably wipe out Hook,-1.0,negative
1394984244942868480,ariukab,@Uyanga_ts @Onon90182120 амжилт2. Би ч Энхбат гуайг балиашиглана өө,2021-05-19 11:52:16,"Tokyo, Japan",2,0,@Uyanga_ts @ Onon90182120 success2. I will take advantage of Enkhbat guai,0.6,positive
1394981378530365441,MNNtweet,Энхбат Элбэгдоржийн зөвлөх бсан юм уу ? https://t.co/hb09o9YO9s,2021-05-19 11:40:52,Mongolia,2,2,Was Enkhbat Elbegdorj&#39;s advisor? https://t.co/hb09o9YO9s,1.0,positive
1392728842062602242,GerReader,"Хүрэлсүх тулдаа л шүүдэй, өөр хэн Жэнког ялах бсы? Хийсэн ажлынхаа үр дүнг хүртэх эрхтэй гэж үзэж байна. Энхбат гуай хэдий оюунлаг хүн ч хүний барьсан суурь дээр гарч ирэх нь. 
МАН-д дотроосоо орчин үетэйгээ зохицоод, цэвэршээд явах төрт ёсны уламжлал байна гэж харлаа. https://t.co/3cHroJOVZ1",2021-05-13 06:30:06,"UB, Mongolia",2,2,"Who else would beat Genco? We believe that we have the right to receive the results of our work. Although Enkhbat guai is an intelligent person, he appears on a human foundation. I saw that the MPP has a tradition of keeping up with the times and purifying itself. https://t.co/3cHroJOVZ1",0.9,positive
1392876715517505538,peaqmn,Энхбат гуайн парти-г сонсох гээд орохоор Мөнхсоёл гуай ярьж таарах юм.,2021-05-13 16:17:42,Mongolia,2,0,"When I went to listen to Enkhbat guai&#39;s party, Munkhsoyol guai was talking.",-1.0,negative
1394915966203609090,khaliunbuga,Солонгос эмч нар Э.Энхбат начны хоёр хөлийг мэдээ орно гэж баталж чадахгүй байна https://t.co/SbFimbzfrj,2021-05-19 07:20:57,Чиний байхгүй газар,2,1,Korean doctors can&#39;t confirm that E.Enkhbat&#39;s legs are covered by news https://t.co/SbFimbzfrj,-1.0,negative
1392981402719645699,khuchutRons,@erdenebatavia +  Энхбат гуайг дэмжээгүй бол бараг орк юу юу ч гэнэ үү,2021-05-13 23:13:41,,2,0,"@erdenebatavia + If you didn&#39;t support Enkhbat guai, the orc would be almost nothing",-1.0,negative
1394977423758970882,daljigar,Новш гэж Хүүкийн дарангуйлалд орохгүйн тулд Эрдэнэд санал өгөхөөс өөр сонголт алга. Энхбат бол МАНы кармааны намаас дэвшиж байгаа Эрдэний санал хуваагч 🥴 https://t.co/rCkrCQgv4V,2021-05-19 11:25:09,,2,1,There&#39;s no choice but to vote for Erdene to avoid Hook&#39;s oppression. Enkhbat is a genius of the MPP&#39;s Karma Party 🥴 https://t.co/rCkrCQgv4V,0.0,neutral
1395023680393015301,nyamkaa,"@Batka_ Хүүк 70, Энхбат 20, Эрдэнэ 10",2021-05-19 14:28:58,"Завхан, Цэцэн-Уул",2,0,"@Batka_ Hook 70, Enkhbat 20, Erdene 10",1.0,positive
1395322659697659904,Dandag_5004,Толгойлогчид нь Эрдэнэлүү урвацан чинь Энхбат ялна ура гэж байсан дагаж далдайдагууд нь хаашаа яахаа мэдэхээ байцан ихаха. Үзэл бодолдоо л үнэн ч байлдаа. Таван цаас хаанаас ч олддымшдэ угнь 😂🤮 https://t.co/QjA1LNOsZZ,2021-05-20 10:17:00,Mongolia,2,1,"The leaders betrayed Erdenelu and Enkhbat said that he would win, but his followers did not know where to go. The truth is in the battle. Five pieces of paper can be found anywhere 😂🤮 https://t.co/QjA1LNOsZZ",-0.9,negative
1395323458683236353,Dandag_5004,Чамаас сайн хуульчид зөвлөгөө өгч байгаалдаа. Тэгээд ч Энхбат Ам нээвэл нтр гээд зөндөөл нэвтрүүлэгээр ороо биздээ https://t.co/T3BXXxIE0v,2021-05-20 10:20:11,Mongolia,2,0,"Better lawyers than you. And if Enkhbat opens his mouth, he will appear on many programs called https://t.co/T3BXXxIE0v",0.2,neutral
1395034862516523009,doogii_jr,Энхбат гуай хоёр ялтантай өрсөлдөх гэж байгаа шдэ🤣 https://t.co/W03tXlR1sx,2021-05-19 15:13:24,"Istanbul, Turkey",1,0,Enkhbat is going to compete with two convicts🤣 https://t.co/W03tXlR1sx,1.0,positive
1395030989634641920,amarbayar_a,"Буянгийн Жагайгийн худал ба 7/1-ний үнэн:
7-р сарын 1-нд Д.Энхбат яг юу гэж хэлсэн бэ. Үймээн самуун тариагүй, иргэд гэртээ харьцгааж, намын дарга нар хэлэлцэх ёстой гэсэн байна. https://t.co/bEPzKFKZrI",2021-05-19 14:58:01,Ulaanbaatar,1,1,"Buyan Jagai&#39;s lie and the truth of 7/1: What exactly did D.Enkhbat say on July 1? There was no riot, people should go home and party leaders should discuss it. https://t.co/bEPzKFKZrI",-0.5,negative
1392825944847503360,bbolorerdenemn,Энхбат гуай одоо Монгол Улсын төлөө зүтгэе гээд дэвшиж бдаг. Генерал нь хэн юм бол:). https://t.co/5MFfgTmn0q,2021-05-13 12:55:57,Ulaanbaatar,1,1,Enkhbat guai is now promoted to work for Mongolia. Who is the general :). https://t.co/5MFfgTmn0q,-0.1,neutral
1393868363097526272,toimch,"Би ч гэсэн Энхбат гуайг шүүмжилвэлл шүүмжилж чадна. Гэхдээ нөгөө 2-той нь харицуулахын аргагүй зөв нэр дэвшигч учраас дэмжинэ. 
Сонгогдсоных нь дараа шүүмжилнэ.",2021-05-16 09:58:09,Mongolia Ulaanbaatar,1,0,"I can also criticize Enkhbat guai. However, I will support the other two because they are the right candidates. Criticized after being elected.",-0.2,neutral
1395030275466223617,BadralMandah,"@Batka_ Хүүк 56%, Энхбат 25%, Эрдэнэ 17%",2021-05-19 14:55:10,,1,0,"@Batka_ Hook 56%, Enkhbat 25%, Erdene 17%",1.0,positive
1395049473093496834,BilgeeOdgiiv,@Uyanga_ts Энэ уг нь гарцаагүй үнэн гэхдээ бодож бодож Энхбат дээр шийдсэн байгаа. ЖАН-аас болоод үхсэн ч Эрдэнээд өгөхгүй гэсэн өчнөөн АН-ын гишүүд байна. Яаж ч ятгаад нэмэргүй . 2 дохоор Энхбат гарна. Гэр хороолол хөдөөд ялахгүй гэдэг нь эндүүрэл. Би яг тэдэн дунд чинь ажиллаж амьдардаг,2021-05-19 16:11:27,,1,1,"@Uyanga_ts This is definitely true, but I thought about it and decided on Enkhbat. There are so many DP members who say they will not give it to Erdene even if they die because of JANG. Persuasion is useless. Enkhbat will be the second. It is a misconception that ger districts do not win in rural areas. I live and work among them",-0.5,negative
1393422291975892996,Odmaa__,@ganzorigv @buyanaa_ts уг нь Энхбат гуай дэвшээгүй бол МАН-д саналаа өгөх байлаа би муухай хүн үү,2021-05-15 04:25:37,Mongolia,1,0,"@ganzorigv @buyanaa_ts If Enkhbat hadn&#39;t been nominated, I would have voted for the MPP. Am I a bad person?",-1.0,negative
1395023539854397440,tugaanaab,Гэгээнтэн гэж хүүк нь юм уу энхбат нь юм уу,2021-05-19 14:28:24,Mongolia,1,0,A saint is a son or a son,1.0,positive
1393859538957262848,margadism,"@gerel0991 @MergenB @artanyan Шийрий хийлгүй яахав, заавал хийсэн хүнийг нь олж дараа дараачийн троллуудад сургамж болог. Ахиад Д.Энхбат, С.Эрдэнийн гэр бүлээр ч тохуурах шинжтэй.",2021-05-16 09:23:05,Mongolia,1,1,"@ gerel0991 @MergenB @artanyan Well, don&#39;t do Shiirii, find the person who made it and learn a lesson for the next trolls. Again, the family of D.Enkhbat and S.Erdene is ridiculed.",-1.0,negative
1393428713912430595,DeTuvshintur,"Жиргээ бол санал өгөх насны хүмүүсийн 2% нь л байгаа болов уу. Бусад хувийн дийлэнх нь Хүрэлсүхийг дэмжих магадлал өндөр. Хүрэлсүх, Энхбат нарын дунд бус Хүрэлсүх Эрдэнэ нарын дунд өрсөлдөөн өрнөнө гэж бодож байна. https://t.co/2ytagCbGs2",2021-05-15 04:51:08,Mongolia,1,0,"Only 2% of people of voting age have tweets. The majority of other individuals are likely to support Khurelsukh. I don&#39;t think there will be competition between Khurelsukh and Enkhbat, but between Khurelsukh Erdene. https://t.co/2ytagCbGs2",-0.1,neutral
1392819960750116864,Davkasuren,"Энхбат начин ухаан орохгүй 40 хонож байна гэсэн байна ш дээ, аймаар юмбэ😔😔",2021-05-13 12:32:10,"Ulaanbaatar, Mongolia",1,1,"Enkhbat has been unconscious for 40 days, you know, it&#39;s awful",-1.0,negative
1395038735050280965,narnii_dor,@hoidnuur Энхбат нь санал хуваахгүй юу,2021-05-19 15:28:47,,1,0,@hoidnuur Enkhbat will share his opinion,1.0,positive
1393869118764314627,toimch,"Энхбат гуайд өө сэв алдаа дутагдал байгаа л байх. Хулгай луйвар завхралын системийг төлөөлдөггүй, тасралтгүй үгээ хэлсээр ирсэн, шинэ үед итгэл найдвар тавьж зоригжуулж ухааруулж явдаг болохоор нь дэмжиж байгаа.",2021-05-16 10:01:09,Mongolia Ulaanbaatar,1,0,"Mr. Enkhbat must have some shortcomings. We support it because it does not represent a system of theft and corruption, it has always spoken out, and it has given hope and encouragement to the new generation.",-0.2,neutral
1393869523401383937,Ogi_Bavaria,@Aanxaa @Aanxaa мөнгөө авцан ажлаа хийж бгаа хүн. Сонгуулиар гэхдээ хэнд саналаа өгхөө мэднээ😁 Энхбат гуай ялнаа. Хэдүүлээ чаднаа Аанхаа✌️,2021-05-16 10:02:45,,1,0,@Aanxaa @Aanxaa is a person who takes money and does his job. But I know who to vote for in the election😁 Enkhbat guai will win. I can do it,0.6,positive
1395036418087563269,D_Jaraa,Энхбат гараад яах ч билээ?Дэмий санал хуваах л ажил!....,2021-05-19 15:19:35,Ulaanbaatar Mongolia ,1,0,What will Enkhbat do when he leaves? It&#39;s just a waste of votes! ....,-1.0,negative
1395037219157512193,TumuruuBat,"У. Хүрэлсүх 57+-%
С. Эрдэнэ 28+-%
Д. Энхбат 15+-% https://t.co/XqT2cWU9Ic",2021-05-19 15:22:46,"Inner Mongolia, People's Repub",1,0,U. Touch 57 + -% С. Erdene 28 + -% D. Enkhbat 15+ -% https://t.co/XqT2cWU9Ic,1.0,positive
1393870571612491777,Tuvshin83047489,@Kheneejingoo Хүнийхээ хувьд Эрдэнэ ч Энхбат ч сул биш Дэмжигчид нь л туйлбаргүй Хүүгийн дэмжигчид маш туйлбартай хаашаа ч хамхуул шиг хийсэхгүй!,2021-05-16 10:06:55,Mongolia,1,0,@Kheneejingoo Erdene and Enkhbat are not weak as human beings. Their supporters are indeterminate.,-1.0,negative
1395030300367867914,Mongolia97602,Цалин буугаад... сүүлчийнхээ мөнгийг нэр дэвшигч Д.Энхбат ахад шилжүүлчлээ... гоёайнаа. https://t.co/UCUbzP8m7A,2021-05-19 14:55:16,,1,0,After the salary was reduced ... the last money was transferred to the candidate D.Enkhbat ... nice. https://t.co/UCUbzP8m7A,1.0,positive
1393950415142621185,Burmaa1919,"@SaruulhanA Энхбат нь арай нэр цэвэр юм даа
Улс төрд тэмцэл зүтгэлийг  хөдөлмөр гэдэг Олны танил болж чадсан эсэх л🤔",2021-05-16 15:24:11,Mongoli,1,0,@SaruulhanA Enkhbat&#39;s name is a bit clearer.,1.0,positive
1395022318687064068,er_munkhbat,@Ganchimeg_n @nambon__ Энхбат Нямаатай адил юм бэ,2021-05-19 14:23:33,Mongolia,1,0,@Ganchimeg_n @nambon__ Is it like Enkhbat Nyamaa?,-1.0,negative
1394952277409009664,hangai21,Б.Жаргалсайхан: Энхбат бол өнөө цагийн улс төрийн ТҮГЖИЛ! улс төрд гаргаж болохгүй хүн! https://t.co/TcvnddeS5M,2021-05-19 09:45:14,,1,0,B.Jargalsaikhan: Enkhbat is a modern political LOCK! Someone who can&#39;t be involved in politics! https://t.co/TcvnddeS5M,-0.5,negative
1393365777311481856,milkchoke,Хүрэлсүхийн буутай зураг хаа сайгүй. Зургаарнь таихгүй хүн нь ч таньдаг боллоо. МАНАЙ ЭНХБАТ гуайг ингэж танил болгоочээ 😁😁,2021-05-15 00:41:03,,1,0,Pictures with touch guns are everywhere. Even people who don&#39;t like the picture know it. This is how our Enkhbat guai was introduced 😁😁,0.0,neutral
1394122091188809728,TsegmidS,"@rad_saran @Dandag_5004 Надаас уучлал гуйх юу байхав дээ. Интернэтийг Эрхэм нэр дэвшигч Дангаасүрэнгийн ЭНХБАТ-ын хувийн бүтээл гэсэн санаа огт байхгүй. Монгол улсад интернэт ашиглах боломж олгосон андагч учраас л хийж буй ажил, нүдэнд үзэгдэж буй үр дүн гэсэн утгаар л хэлсэн.",2021-05-17 02:46:22,,1,0,@rad_saran @ Dandag_5004 Why don&#39;t you apologize to me? There is no idea that the Internet is the personal work of the Honorable Candidate Dangaasuren Enkhbat. It is said in the sense that it is a work in progress and a visible result because it is the hunter who gave Mongolia access to the Internet.,-1.0,negative
1394125796265005059,toimch,"Галигаагийн Баярсайхан гэж нөхөр Энхбат гуайг муулсан постоор фэйсбүүк сурталчилгаа явуулаад байна гэсэн.. 7 удаагийн сурталчилгааг 1797$-р явуулжээ. Хэний мөнгөөр хүн муулав, эх үүсвэрийг нь шалгахсан..",2021-05-17 03:01:06,Mongolia Ulaanbaatar,1,0,Bayarsaikhan Galigaa said that she was running a Facebook advertisement on a post that slandered her husband Enkhbat guai. Whose money was used to slander people and their sources were checked ..,0.0,neutral
1392858187062288386,DorjnamjimL,"Өнөөдөр нэг тийм сайхан ирээдүйд итгэх итгэл, урам хүмүүст өгөх эерэг мэссэж л үгүйлэгдэж байна даа. Энхбат гуай эерэг кампани явуулаасай.",2021-05-13 15:04:04,,1,0,What is missing today is a positive message to give people hope and encouragement for such a bright future. May Enkhbat run a positive campaign.,1.0,positive
1394967944187289602,myagmardorj_,Энхбат гуай гарнаааа https://t.co/sqcF4R5CLU,2021-05-19 10:47:29,Ulaanbaatar,1,0,Mr. Enkhbat will leave https://t.co/sqcF4R5CLU,-1.0,negative
1394958362559778819,narangoo_khatan,"@L1_5EarthMoonMN Манайхаас маш том 1 ялгаа харагдаад байдын, тэр том  амээрхийн ерөнкийлөгч эд нар чинь их гоё инээмсэглэж ярихын, манай МАНгарууд болохоор дандаа л загнасан, хөмсөг зангидаж, хөмхийгөө зуусан, хорслын харцаар харсан хүмүүс байхын. 

Энхбат гуай харин эд нарт дөхөх имижтэймдаа.",2021-05-19 10:09:25,Mongolia,1,0,"@ L1_5EarthMoonMN There is a big difference from us, the presidents of that big world are smiling and talking, our Mangars are always scolding, frowning, frowning and looking at each other with a stern look. Enkhbat guai has an image that is close to them.",0.6,positive
1394500482140450819,soyoloo81478488,"@Odkhuu_D энхбат гарахгүй шт, гол өрсөлдөөн АН МАН 2 болох байх даа, Энхбат санал хуваагч...",2021-05-18 03:49:58,,1,1,"@Odkhuu_D Enkhbat will not run, the main competition will be DP and MPP 2, Enkhbat is a divider ...",-1.0,negative
1394139466722275333,AltanOd_,"Энгийн харьцуулалт:

Энхбат гуайн Идэрээтэй хийсэн podcast 416k үзэлттэй❤️🙏

Хүүкийн 4 жилийн өмнө орсон 100 эрхэм нэвтрүүлэг 115к үзэлттэй. 😂😝",2021-05-17 03:55:25,UlanBator Mongolia,1,0,Simple comparison: Enkhbat&#39;s podcast with Ideree has 416k views❤️🙏 Hook&#39;s 100 best programs from 4 years ago have 115k views. 😂😝,0.0,neutral
1393418867972653056,Buural_ovogt,"@Munkhsoyol_Econ @GTsognemekh @Mandolinchin Яг одоо энхбат руу ""аймар шуналтай гэнээ"" гэсэн явган тараад буй үүний ерөндөг тактикаа бодох л хэрэгтэй. Дэмжигчдийн ""нүд хуруу"" баг явалт үр дүнгүй бгааг бүгд харж бга. Надад төрсөн бодол бий",2021-05-15 04:12:01,Ulaanbaatar,1,0,"@Munkhsoyol_Econ @GTsognemekh @Mandolinchin Right now, we need to think about the IUD tactics that are spreading to Enkhbat that he is &quot;terribly greedy&quot;. Everyone can see that the &quot;eye and finger&quot; team of supporters is ineffective. I have a thought",-1.0,negative
1394950461493370881,Luvsanshagjaa,"Энхбат гуайг улс төрийн түгжил гэж байна шд 
😳😳😳
#Жаргалсайхан
#АмНээвэл",2021-05-19 09:38:01,Mongolia,1,0,Enkhbat guai is called a political lock 😳😳😳 #Jargalsaikhan #Open,-1.0,negative
1394142108471070728,erdenebatavia,@iMementoMori @batengineer Энхбат гуай байгаагүй бол Монгол Улс интернетгүй байх байсан гэх гээд байгаамуу муахахав Бас л попорч чадаж байгаан шүү,2021-05-17 04:05:55,"Ulaanbaatar, Mongolia",1,3,"@iMementoMori @batengineer If Enkhbat guai hadn&#39;t existed, Mongolia would not have internet.",-1.0,negative
1394143173065068547,munkhtamire,@bayaraashuu Энхбат байгаагүй бол Монголд интернэт байхгүй байх байсан..,2021-05-17 04:10:09,Mongolia,1,0,"@bayaraashuu Without Enkhbat, there would be no internet in Mongolia ..",-1.0,negative
1394143373599019009,erdenebatavia,1925 онд ЗХУ манайд хэдэн онгоц өгөөгүй бол бид нар одоо иргэний агаарын тээвэргүй байх байлаа гэсэн үг юм уу. Зүгээр л бизнес биз дээ интернетийг Монголд оруулж ирэх чинь. Энхбат гэж хүн хийгээгүй бол дараагийх нь нээх удахгүй оруулаад ирэх л байсан даа. https://t.co/uXotZ3tKEE,2021-05-17 04:10:56,"Ulaanbaatar, Mongolia",1,1,"If the Soviet Union hadn&#39;t given us a few planes in 1925, would we not have civil aviation now? It&#39;s just a business to bring the Internet to Mongolia. If Enkhbat hadn&#39;t done it, the next one would have been opened soon. https://t.co/uXotZ3tKEE",0.0,neutral
1394944413965684740,ShijireeB,"МАН-хан Энхбат руу 7 сарын 1-нийг аллагын бурууг чихэх гэж байгаа бол өөрсдийгөө л эвгүй байдалд оруулна шүү! Сонгууль луйвардаж, иргэдээ буудсаныг арай ч мартчихаагүй байна аа... https://t.co/y4BntYCrzu",2021-05-19 09:13:59,Mongolia,1,0,"If the MPP is going to blame Enkhbat for the July 1 murder, they will embarrass themselves! I have not forgotten that the election was rigged and people were shot ... https://t.co/y4BntYCrzu",0.0,neutral
1394940347474661376,dobuhan,"@UblineMn Элбэгээ сайн ярьдаг, Энхбат сайн бичдэг гоё жиргэдэг. Хоёулаа хэл устай, Энхбат нь Элбэгээгийн зөвлөх байсан. Ерөнхийлөгч болж болохоор хүн",2021-05-19 08:57:50,Mongolia,1,0,"@UblineMn Elbeg speaks well and Enkhbat writes well. Both are fluent, and Enkhbat was Elbegee&#39;s advisor. A person who can become president",1.0,positive
1394937576021053440,shineeebold,@SaruulhanA хөөх би худалдагдаагүй. харин ч Энхбат гуай нэг эвгүй тайлбар өгсөн байна лээ. бараг нет минийх ухааны. энэ хүмүүс 🤮🤮🤮,2021-05-19 08:46:49,,1,0,"@SaruulhanA Wow, I&#39;m not sold. On the contrary, Enkhbat guai gave an awkward explanation. almost out of my mind. these people 🤮🤮🤮",0.0,neutral
1394103139381383169,erdenebatavia,"@SaruulhanA Би цензурдээгүй ээ тухайн хүнийг нэр дэвшүүлсэн нам нь болон бусад дэмжигчид нь бид нар Энхбат бол мэдлэгтэй боловсролтой мундаг, бусад 2 нь харанхуй бүдүүлэг гэж бичихийг зөвшөөрөхгүй л гэсэн байна лээ",2021-05-17 01:31:04,"Ulaanbaatar, Mongolia",1,0,@SaruulhanA I&#39;m not censored. The party that nominated the person and other supporters said that we would not allow Enkhbat to be described as well-educated and the other two as dark and rude.,0.0,neutral
1394095723642179587,bbatzl,@Uralmgl Энхбат где? Как это это так без улыбок😀... Без бутылок?,2021-05-17 01:01:36,Mongolia,1,0,@Uralmgl Where is Enkhbat? How is it so without a smile😀 ... Without a bottle?,0.0,neutral
1394078728355864577,Gankhuy19077308,Д.Энхбат гуайг дэмжмээр байвал Доржханд минь өөрөө холхон бай! МАН-ын хөлсний цэрэг чамаас хүмүүс ой гутаж байгаа! https://t.co/FUd9RdBKzZ,2021-05-16 23:54:04,,1,0,"If you want to support D.Enkhbat guai, stay away from Dorjkhan! People are disgusted with you, MPP mercenary! https://t.co/FUd9RdBKzZ",0.0,neutral
1394987205970513922,Uyangaadorj,@UblineMn Сайхан эхнэртэй хүн ерөнхийлөгч болох ёстой гд л Энхбат гуайн эхнэрийн зургийг сэвж өгсөн шд. Яг ямар хүн ерөнхийлөгч болох ёстой юм бэ?,2021-05-19 12:04:02,,1,0,@UblineMn A man with a beautiful wife should become president. Who exactly should be president?,0.7,positive
1392826953074241539,DavaaGombosuren,@Batka_ Би таныг Энхбат гуайг дэмжээд байна гэж ойлгосон.,2021-05-13 12:59:57,Ulaanbaatar,1,1,@Batka_ I understand that you support Enkhbat guai.,0.0,neutral
1392831976269176837,BoldkoD,@khulan9009 Датакомын Энхбат гэж мэднэ ээ мэднэ хөдөөний сумын хүүхэд ш дээ,2021-05-13 13:19:55,Монголия,1,0,"@ khulan9009 I know Enkhbat from Datacom, I know he is a child from a rural soum",-1.0,negative
1393414840849371136,Bishreltei,@AEnkhtsetseg Энхбат гуай ядаж худлаа попрохгүй хүнд хэрэгтэй юм яриад сууна шүү дээ хэхэ 76 үхэрнүүдэд сайн нөлөөлөл үзүүлж чадах байх хэхэхэ жиргээнд залууст нөлөөлдөг шигээ хэххэ,2021-05-15 03:56:01,Mongolia,1,0,"@AEnkhtsetseg Enkhbat guai, at least he doesn&#39;t lie, he talks about things that are useful to people lol 76 He can have a good effect on cows lol",1.0,positive
1395007395764523011,mardai_p,Зохион байгуулагч Д.Энхбат https://t.co/0tpe4OTNP0 https://t.co/YOeBkYyaqj,2021-05-19 13:24:15,Mongolia,1,1,Organizer D.Enkhbat https://t.co/0tpe4OTNP0 https://t.co/YOeBkYyaqj,0.0,neutral
