Expression Label,tweets
negative,"Хэзээ ч эрх мэдэл, албан тушаалд очихгүй Л.Оюун-Эрдэнэ 2018.12.28 https://t.co/QBSNC4TdLl"
negative,"У.Хүрэлсүх, Оюун-Эрдэнэ хоёр байгаа тулдаа л Оюу толгойн асуудал нааштай явж байгаа ... via 
@bbat_erdene"
positive,"Ерөнхийлөгчид нэр дэвшихээр Сонгуулийн ерөнхий хороонд бүртгүүлээд буй УИХ-ын гишүүн, МАН-ын дарга У.Хүрэлсүх, УИХ-ын гишүүн асан С.Эрдэнэ, “Датаком” компанийг үүсгэн байгуулагч Д.Энхбатнарын гэргийг уншигч та бүхэнд танилцуулж байна. 
https://t.co/AxdDOPjgfU"
neutral,"Б.Бат-Эрдэнэ: Б.Ундармаагийн Капитал банкнаас мөнгөө ав‼️

ХНХЯ: 2007 оноос байршуулсан... Найдвартай банк байв‼️

УИХ-ын гишүүн асан Б.Ундармаагийн хамаарал бүхий Капитал банкинд НДС-ийг 100 гаруй тэрбум төгрөг хадгалагдаж байв. Харамсалтай нь дампуурч иргэд нийтээрээ хохирсон. https://t.co/Exd1gaTeMC"
positive,@Kheneejingoo @DNN_MN Эрдэнэ эхнэртэйгээ ямар адилхан юм.
negative,"Л.Оюун-Эрдэнэ: Ц.Анандбазар түдгэлзээд шалгуул!!!

У.Хүрэлсүх: Ц.Анандбазар түдгэлзээд шалгуул!!!

УИХ-ын гишүүн Ц.Анандбазарын ёс зүйн асуудлаарх дуулианд Монгол Улсын Ерөнхий сайд Л.Оюун-Эрдэнэ, МАН-ын дарга У.Хүрэлсүх нар ижил байр суурь илэрхийлж байна.

МАН 🆚 Ц.Анандбазар https://t.co/kBLe36ab6W"
positive,"твиттерт Энхбат гуайг дэмжсэн нь мундаг, Эрдэнэ ба Хүрэлсүхийг дэмжсэн нь мулгуу болж дуусах шинжтэй шүү😂😂😂"
positive,"Сонгууль болж бгаа, гэхдээ 2020 онд Эрдэнэ АН 2-г газар доогуур хийгээд, МАН-ыг дэмжээд Хүрэлсүхдээ итгэж бнаа гээд жиргэж бснаа 10 сарын дараа Хүүк баба, Эрдэнэ даргаа та шүү гээ чаах гэхдээ ямар уу?! Гаагүү бгаа 😜😂"
negative,"@Enerell Эрүүл мэндийн даатгалын тогтолцоог (ядахдаа гэнэтийн ослын даатгалыг) олон улсын жишигт хүргэх ажлыг эхлүүлмээр байна. 
Төрөөс Даатгалын хөрөнгө мөнгийг нь салгахгүй бол С.Эрдэнэ мэтийн төрийн нэр барьсан хулгайчдад цаашид алдах нь тодорхой"
positive,Шинээр зам эхлүүлээс илүү Улаанбаатар-Дарханы замыг яаралтай дуусгах нь чухал гэж Ерөнхий сайд Л.Оюун-Эрдэнэ хэллээ. https://t.co/tGZ7UBjg6k
positive,"Монгол Улсын Ерөнхий сайд Л.Оюун-Эрдэнэ Улаанбаатар-Дархан чиглэлийн автозамын барилгын ажлын явцтай танилцсан. Энэ үеэр Дархан-Улаанбаатар чиглэлийн авто замыг 2022 оны аравдугаар сар гэхэд ашиглалтад оруулж, хүлээлгэн өгнө гэдгийг Зам, тээврийн хөгжлийн сайд Л.Халтар хэллээ. https://t.co/KXQ7Z2XdNF"
neutral,"Ж.Бат-Эрдэнэ: НДС бол буяны сан биш‼️

ХНХЯ: НДС-гийн цэвэр алдагдал ₮72.6 тэрбум‼️

""НДС улсын төсвөөс жилд ₮499 тэрбумын татаас авч байна. Тэтгэвэрт гарч буй хүмүүсийн 54% нь л ердийн горимоор гардаг. Бусад нь онцгой нөхцөлд хамрагддаг"" гэж ХНХ-ын сайд А.Ариунзаяа хэлж байна. https://t.co/Bgz07BtV8J"
negative,@amaraaliberty Эхний шатанд хэн хасагдах бол? Миний бодлоор С.Эрдэнэ мултрах байх.
positive,"Дархан-Сэлэнгийн авто замаас Шаамар-Зүүнбүрэн-Цагааннуур-Түшиг-Зэлтэрийн боомт чиглэлийн 120.85 км хатуу хучилттай авто зам төслийн явцтай Монгол улсын Ерөнхий сайд Л.Оюун-Эрдэнэ танилцлаа
https://t.co/xrsoyThHpq https://t.co/ggRNI3eLr3"
negative,"@margadism Хүрэлсүхийн попролтыг дахин6 жил харж бүтэхгүй ээ, Эрдэнэ угаасаа биш.
Энхбатыг л сонгож таарлаа"
negative,"МоАХ-с намуудыг тараах тэмцэл эхлүүллээ гнэ.1989 онд болсн Залуу у/бүтээлчдийн зөвлөгөөн дээр МоАХ бгуулагдсаныг зарлаж,анхны даргаар Зоригийг сонгож бж.Дара нь Элбэгдорж,Эрдэнэ г.м хүмүүс  даргаар  ажиллаж бгаад 2007 онд Баттулга болж,өнөө хүртэл  у/төрийн  тэмцэлдээ ашиглаж бна"
positive,"1.Энхбат, 2.Хүрэлсүх, 3.Цагаан хуудас, 4.Эрдэнэ. Эхний санал хураалтын дараалал. https://t.co/TTJjdoYXTE"
negative,"@HuygaaHuyagaa Хүүк огцор
Бат үүл зайл
Эрдэнэ нофш......"
negative,"Саяхын хүртэл бүгд л хаа сайгүй л ийм байсан, ийм байж болдог байсан. Харин хүмүүсийн хандлага өөрчлөгдаж байгаа нь сайшаалтай. Миний багад 20 гаруй жилийн өмнө байсан, дээгүүр гүйж явсан, юун Эрдэнэ огт хамаагүй https://t.co/89zBRBae0P"
positive,Л.ОЮУН-ЭРДЭНЭ: МОНГОЛ УЛС МАЛ АЖ АХУЙН САЛБАРААС НЭМҮҮ ӨРТӨГ ШИНГЭСЭН БҮТЭЭГДЭХҮҮН ЭКСПОРТОД ГАРГАХ ЦАГ БОЛСОН https://t.co/osM0QQwjmT
negative,"Монгол улсын Ерөнхий сайд Л.Оюун-Эрдэнэ тариалангийн гол бүс нутаг болох Дархан, Сэлэнгэд ажиллаж байгаа билээ. Түүнтэй хамт Сэлэнгэ аймгаас сонгогдсон УИХ-ын гишүүн Ж.Эрдэнэбат нар дагалдан явж байна
https://t.co/7QMogVYohq https://t.co/awLt0Sq5qp"
negative,@tod_medee Дарханы зам бол Ашиглалтанд орох хугацаа нь 2 удаа хоцрогдгоо хоцорсон. Харин хүмүүсийн мартамхайг далимдуулж Дарханы замыг МУ-ын ЕС Оюун-Эрдэнэ хугацаандаа ашиглалтанд өгнө гэж ярих нь зөв үү? Хүмүүсээ.
positive,"М.Оюунчимэг: Б.Бат-Эрдэнэ гишүүн зөрүүтэй юм хэлчихлээ‼️

Б.Бат-Эрдэнэ: М.Оюунчимэг барагтайхан байх хэрэгтэй‼️

""УИХ-ын гишүүн С.Ганбаатар өлсгөлөн зарлаж, эх оронч гишүүд дэмжсэний хүчинд Оюутолгой ордын үр өгөөжийг ард түмэн хүртсэн"" тухай УИХ-ын гишүүн Б.Бат-Эрдэнэ ярьсан юм. https://t.co/d5LgRMQAjL"
positive,"Өнөөдөр МУ-н ЕС Л.Оюун-Эрдэнэ УБ-Дарханы автозамын ажил, арьс ширний цогцолбор,Залуусын орон сууцны хороолол барих төслүүдтэй танилцаж,гүйцэтгэж байгаа компаниудын удирдлагад ажлаа хугацаанд нь чанартай гүйцэтгэхийг анхааруулж, ЗГ-н зүгээс бүх талаар дэмжиж ажиллахаа илэрхийллээ. https://t.co/h0QmkNejuf"
positive,LIVE: Ерөнхий сайд Л.Оюун-Эрдэнэ Алтанбулагийн чөлөөт бүсийн үйл ажиллагаатай танилцаж байна
negative,Ерөнхий сайд Л.Оюун-Эрдэнэ Сэлэнгэ аймагт ажиллах үеэрээ “Дархан-Сэлэнгийн бүс нутгийг илүү эрчимжүүлсэн бүс болгон хөгжүүлэх зайлшгүй шаардлага байгааг онцоллоо  #МОНЦАМЭ #МонголМэдээ #ОронНутаг https://t.co/4ReVMOygK7
negative,"@khulan9009 Хүүе нээрээ тэр Ерөнхийлөгчид дэвшээд байгаа Эрдэнэ гэж ахыг би танихгүй байгаамаа. Яг юу хийсэн, юу хийж бүтээх хүн юм бол?"
neutral,"АН-ын генсек Ч.Өнөрбаяр үг үйлдэлээ нэгтгэхийг МАН-д сануулав‼️

* У.Хүрэлсүх, Л.Оюун-Эрдэнэ... Хариуцлагаас зугтлаа
* Сүржин мэдэгдэл, шударга дүртэй харагддагаа боль
* Ц.Нямдорж тэргүүтэй сайд нар хэрэг ярих эрхгүй
* Бүх зүйл хуулийн дагуу явагддаг байх ёстой

Ч.Өнөрбаяр 🆚 МАН https://t.co/mdpBKGU9BZ"
negative,"Хүрэлсүх, Эрдэнэ нарыг сайн муугаар нь ядаж гадарладаг. Хэн дэвшиж байгааг мэдэх л гэсэн үүднээс Энхбат гэж хүнийг таних гээд асуусан хөдөөнийх эсвэл хотын захынх болчлоо доо хөөрхийс. Элит хүн л Энхбатыг дэмжих юм байх. 

За уучлаарай. Ингэж хүн доромжлохгүй ээ. 🤦🏻‍♀️🤦🏻‍♀️🤦🏻‍♀️"
negative,"Хүрэлсүх ярилцлагадаа ЕС бхдаа 900 уул уурхайн лицензийг хурааж,төрийн өмчийг хууль бусаар хувьдаа авсан олигарх нартай тэмцэж,улс орон,ард түмэндээ буцаан авч чадсан гэнээ.Харин түүний оронд С.Эрдэнэ Д.Энхбат хоёр бсан бол ийм зоригтой шийдэж чадах бсан болов уу?Би нам бус иргэн"
neutral,Тм ангалзуур бж этр. Эрдэнэ тэгсэн надархуу даруухан бэ этр 😂 https://t.co/N9H5FFZ94N
negative,"Л.Оюун-Эрдэнэ: Бид өндгөө ч импортоор, махаа ч импортоор авч бна. Тиймээс Дархан,Сэлэнгийн нутгийг эрчимжүүлсэн ХАА-н бүс болгож хөгжүүлэх зайлшгүй шаардлагатай байна https://t.co/jKfkcXvD3c"
negative,"Л.Оюун-Эрдэнэ: Долдугаар сарын 1 гэхэд халдвар буурахгүй  бол төрөөс олгож буй хөнгөлөлтүүдийг он дуустал үргэлжлүүлнэ..
- Халамжийн мөнгө нэмэгдсээр
Төгрөгийн худалдан авах чадвар унасаар..тэгээд дүндээ дүн, үр дагавар нь муу боло вий дээ...
https://t.co/vRDIN7QI0a"
negative,Л.Оюун-Эрдэнэ: 6 сарын 1-н гэхэд замын ажлаа эхлүүлэхгүй бол тус компанийн концессийн гэрээг цуцал. Бүх шатанд хариуцлагын асуудал яригдана шүү https://t.co/kIdrCTAY9N
positive,"Хүрэлсүх Оюун-Эрдэнэ хоёр хэрэгт холбогдсон гишүүнээ, намын гишүүнчлэлээс татгалзуулж шалгуулна гэж шийдсэн нь үнэхээр зөв хөөрхөн үйлдэл боллоо шүү.
Одоо Амарсайханыгаа л даа"
negative,"Ижийгээ амьдад үхэж болохгүй
Ижий мниь цээжиндээ наргүй болноо
Ертөнцийн гоо үзэсгэлэн гундаа
Ерөөлтэй ижий минь гандаж хоцорно (А. Эрдэнэ-Очир “Ижийтэй хүн үхдэггүй”) https://t.co/KgqJTi3dUB"
positive,@mungundalai1 Эрдэнэ даргын эхнэр намбалаг сайхан л хүн байдаг юм.Мэддэг таньдагын хувьд...3 уулаа л сайхан тэргүүн хатагтай болох нь..
negative,@ShinegerelR Анд Эрдэнэ даргаа ялуулчих гээд л тандаж сууна уу итар...
positive,"Л.Оюун-Эрдэнэ: Дархан, Сэлэнгийн бүс нутгийг эрчимжсэн хөдөө аж ахуйн бүс болгоно.
https://t.co/zrUJfBRf2f https://t.co/djYvai5tFJ"
neutral,"АН-с нэр дэвшигч С.Эрдэнэ мэдэгдэл хийсэнд Пакистанууд маш их дургүйцэж байгаа юм байна 😆
ЖАНхуурсан юм... https://t.co/taOkyjq30F"
neutral,Пакистанчууд л С.Эрдэнэ мэдэгдэл хийхэд их ууртай дургүй байгаа юм байна. https://t.co/zy9oUSpVkm
negative,@m_zorigt Эрдэнэ л АН г тараах нөхцөл бүрдүүлсэн. Тамгаа өгчихөөд МАНаар шинэ тамга хийлгүүлээд бөөн будлиан.
neutral,Цаана чинь С.Эрдэнэ мэдэгдэл хийсэн чинь Пакистанчууд уурлаад сүйд. 😂 https://t.co/lwwDcTtBVH
positive,Оюун-Эрдэнэ дүү зурагаа аваарай ! https://t.co/JlWdJgDEeo
negative,С.Эрдэнэ-н яриаг ойлгохгүй уурлаад байгаа юм байхдаа эсвэл ойлгоод уурлаад байгаа юу 🤣🤣🤣 ер нь энэ мэдэгдлийг эд нар яаж үзчихэв 🤣🤣🤣 https://t.co/HsDFOTTNRs
negative,С.Эрдэнэ хэргээ хэрэгсэхгүй болгуулаад нэмээд МАН аас хэдэн төгрөг авч байгаа вэ?
negative,"@Ganbaa80101074 Ийм нөхцөлд аймаг,нийслэл,сум,дүүргүүдэд Эрдэнэ сонгуулийн штаб байгуулвал бөөн хэрүүл тэмцэл,маргаан болох нь ойгомжтой."
negative,"@amgaaamgalanba1 Хүрэлсүх, Эрдэнэ 2г бол дэмжихгүй. Үлдсэн ахад бол саналаа өгчихөд бас яах вээ болжийна"
negative,"У.Хүрэлсүх, С.Эрдэнэ 2-н хэн нь ч хэрэггүй дээ. Хоёул хууль хяналтын байгуулгад ноцтой шалтгаанаар шалгагдаж байсан олиггүй гарууд гэж л боддог."
negative,@Odkhuu_D @olimpic20201 МАН засагласан жилүүд үргэлж ухралт бсан Оюун-Эрдэнэ өөрчилж чадах уу??
positive,"Хөвсгөлийн багш, сурагчид болон шавь Б.Хүслэн-Эрдэнэ минь ""Мөнх тэнгэрийн бичиг""-т амжилттай оролцжээ.❤️

Монгол орны өнцөг булан бүрээс оролцсон багш, сурагчдыг шалгаруулан урамшуулж, тэдний бүтээлийг хотын гудамж талбайд дэлгэн сурталчилж буй ЕТГ-ын хамт олонд талархъя! 👏🏻 https://t.co/EgTPKJZV0k"
positive,"Л.ОЮУН-ЭРДЭНЭ: СЭЛЭНГЭ, ДАРХАНЫГ УУЛ УУРХАЙН ЭДИЙН ЗАСГИЙГ ОРЛОХУЙЦ МАЛ, АЖ АХУЙ, ГАЗАР ТАРИАЛАНГИЙН ЭРЧИМЖСЭН БҮС НУТАГ БОЛГОНО https://t.co/y8QyXOivpi https://t.co/SwFlo9qDQY"
neutral,Краш маань гарч байна :) нөгөө хэний эхнэрийн хэлдгээр юун ч олон краштай юм билээ ха ха. Эрдэнэ засгийн унага зохиол дээр нэг бүсгүйг шар тосны самнаа шиг сайхан бүсгүй шүү гэдэг билүү нэг их гоё тодорхойлдог юм. Тэр зохиолыг ахиад олоод уншчих юмсан. https://t.co/zC7RPrtT7f
negative,"Ерөнхий сайд Л.Оюун-Эрдэнэ хаврын тариалалтын явц, эрчимжсэн маа-н үйл ажиллагаатай танилцахдаа “Дархан, Сэлэнгийг уул уурхайн эдийн засагтай эн зэрэгцэх, өсөн нэмэгдэх, шавхагдашгүй нөөц бүхий эрчимжсэн хаа-н бүс нутаг болгохын төлөөЗасгийн газар бодлогоо чиглүүлэх болно” гэжээ https://t.co/Uu1JZsmPOf"
negative,"С.Эрдэнэ нь байна уу, Н.Алтанхуяг нь байна уу, хэн нь ч бай, Ардчилсан намаас Ерөнхийлөгчид нэр дэвшлээ гэхэд ялах магадлалгүй болсон. Ингэж дотроо зодолдож байгаа хүмүүст яаж иргэд итгэж төрийн тэргүүний сэнтий өгөх вэ дээ. Хэнд ч ойлгомжтой."
negative,Монгол нэртэй хүн лав алга 🤣🤣🤣 Эрдэнэ даргын ярьсныг яаж ойлгоод уурлаад байдын бол 🥴 https://t.co/2y6qFh6htE
positive,@otgonjargal Эрдэнэ өвөө яг санта өвөө шиг бшд 😍😂
positive,Ерөнхий сайд Л.Оюун-Эрдэнэ Шилдэг татвар төлөгч Арвинхур компаний үйл ажиллагаатай танилцлаа https://t.co/An2xepwcnE #Сангийн Яам # mof_gov_mn via @MOFMongolia
negative,"Ерөнхий сайд Л.Оюун-Эрдэнэ хаврын тариалалтын явц, эрчимжсэн маа-н үйл ажиллагаатай танилцахдаа “Дархан, Сэлэнгийг уул уурхайн эдийн засагтай эн зэрэгцэх, өсөн нэмэгдэх, шавхагдашгүй нөөц бүхий эрчимжсэн хаа-н бүс нутаг болгохын төлөөЗасгийн газар бодлогоо чиглүүлэх болно” гэжээ https://t.co/xOPpKExnpx"
negative,@amaraaliberty Хүүзийн ЗГ чадлынхаа хэрээр зөөсөн дөө. С.Эрдэнэ л харин гаднаас хүмүүсээ авчрах хэрэггүй гээд бсан биздээ.
positive,"Амьдрал мөнхийн зүүд минь тэнгэрийн зурсан зураг минь
Алдааг нь тоолоход ч жаргал амтагдмаар хонгор минь
Алсаас надруу урссан цаг хугацааны зэрэглээн дундаас
Амжиж миний олж харсан үл мэдэг инээмсэглэлт минь ...

А.Эрдэнэ-Очир ""Голын тохой дээр"" https://t.co/7mYvdLBnGz"
positive,"...Цэх зогсоод буудуулсан ч сум хүрэхгүй алс
Цээжний гүнд эх орон минь бий...

Арлааны Эрдэнэ-Очир"
negative,"“Дайсан нөхрөө ялгах гэж сэтгэлээ эвдэж явсангүй ээ”  

А. ЭРДЭНЭ ОЧИР https://t.co/tVv1K0wZqn"
negative,"Манай үеэл дүү Эрдэнэ их муу хүн гэнээ. за яг яасы гэсэн , мэдэхгүй муу хүн л гэсэн гэх. тодорхой хэлэх юм юу ч байхгүй зүгээр л хар пиараар бүх улс төрчид нэгнийгээ муу хүн болгоцон. тархийг нь зад угаагаад явууллаа, АНд элсэнэ л гэж шаажээн. энэ нөхөр сонгууль болтол хэд эргэнэ"
positive,"""Пакистанчууд"" У.Хүрэлсүх-д 3000 зүрх дарж дэмжиж байгаагаа илэрхийлсэн бол С.Эрдэнэ-д 2200 ууртай эможи дарж ""дургүйцлээ"" илэрхийлжээ. 

У.Хүрэлсүхийн видеог 244к хүн үзэхдээ 14500 эможи, 25000 шейр хийжээ.
С.Эрдэнийн видеог 144к хүн үзсэн ч 4300 эможи, 242 шейр хийжээ. https://t.co/C1SvNITtIv"
positive,"Сүүлийн 50 жилд think tank-ууд яаж аажмаар академик (их сургуулиуд) хүрээллийн нөлөөг хумьж, эсрэгээрээ өөрсдөө бодлого тодорхойлогчдод илүү нөлөөтэй болсон талаар их сонирхолтой, op-ed маягаар бичсэн scholarly article уншиж бна. Google scholar-с олдсон эрдэнэ байлаа энэ!"
negative,Л.Оюун-эрдэнэ: Монгол улс мал аж ахуйн салбараас нэмүү өртөг шингэсэн бүтээгдэхүүн экспортод гаргах цаг болсон https://t.co/YsAI4KnUwV
positive,Монгол Улсын Ерөнхийлөгчийн сонгуульд Ардчилсан намаас нэр дэвшигч С.Эрдэнэ https://t.co/zW92N5zHQk
negative,"АН-аас ерөнхийлөгчийн сонгуульд нэр дэвшигч С.Эрдэнэ: 
""Х.Баттулга хэзээ нэгэн цагт хийсэн алдаатай алхмынхаа шанг хүртэнэ гэж би сануулсан"" https://t.co/PLN0j6g37k"
negative,"Хүүк-ийг дэмжигчид надад бол нэг иймэрхүү дүр төрхтэй харагдаад байгаа.
Хүүкийг дэмжигч:
- Эрдэнэ ял авч байсан. 
Эрдэнийг дэмжигч:
- Хүрэлсүх ч бас ял авсан.
Хүүкийг дэмжинч:
- Тэр ямар хамаатай юм. Аль дээр үеийн явдал.
:-o"
negative,"Л.Оюун-Эрдэнэ: Дархан, Сэлэнгийг уул уурхайн эдийн засагтай эн зэрэгцэх, эрчимжсэн хөдөө аж ахуйн бүс нутаг болгоно https://t.co/NbxJXbwbMv https://t.co/RogG8tXEw1"
negative,"Нөгөө л новшийн шалтаг аа 3 -4 жил точоод л хүмүүс онхолдож үхсээр л байх юм! МАН-н 4 засгийн нүүр үзлээ? Дуусдаггүй ээ! 
Л.Оюун-Эрдэнэ: Дарханы замыг Л.Халтар сайд толгойгоороо хариуцна шүү https://t.co/aOWWtUGQqJ"
neutral,"Толгой цавчдаг сайдтай болсон юм байна. 

Л.Оюун-Эрдэнэ: Дарханы замыг Л.Халтар сайд толгойгоороо хариуцна шүү https://t.co/qnLAEm3W97"
positive,Ерөнхий сайд Л.Оюун-Эрдэнэ Шилдэг татвар төлөгч Арвинхур компаний үйл ажиллагаатай танилцлаа https://t.co/smyC5pD2Qw
negative,"“... Чөдөртэй морины мөр шиг амьдралын зураг сүлжээнд
Чөтгөр бурхан хоёр нэг бутанд 
Өр хатуу энэ орчлон дээр зовлон жаргал ялгалгүй
Өөрийгөө эрсээр яваад л орчлонг ололгүй буцахгүйсэн ...” 📖🖋

~Арлааны Эрдэнэ-Очир 📚 https://t.co/Or7GCP12qm"
positive,"Л.Оюун-Эрдэнэ: Сэлэнгэ, Дарханыг МАА, газар тариалангийн эрчимжсэн бүс болгоно https://t.co/UT3Daxk5cF"
positive,"“Амьдрал мөнхийн зүүд минь, 
тэнгэрийн зурсан зураг минь
Алдааг нь цуглуулахад ч 
жаргал амтагдмаар хонгор минь
Алсаас надруу урссан 
цаг хугацааны зэрэглээн дундаас
Амжиж миний олж харсан 
үл мэдэг инээмсэглэлт минь...” 📖🖋

~ Арлааны Эрдэнэ-Очир 📚 https://t.co/pIRQDbId3H"
negative,"Л.Оюун-Эрдэнэ: Сэлэнгэ, Дарханыг уул уурхайн эдийн засгийг орлохуйц мал аж ахуй, газар тариалангийн эрчимжсэн бүс нутаг болгоно
https://t.co/UQlf4f5hva https://t.co/lCFX2SqpQr"
positive,"Л.Оюун-Эрдэнэ: Сэлэнгэ, Дарханыг мал аж ахуй, газар тариалангийн эрчимжсэн бүс нутаг болгоно https://t.co/ORwfN2Cq2S"
positive,"Л.Оюун-Эрдэнэ: Сэлэнгэ, Дарханыг уул уурхайн эдийн засгийг орлохуйц МАА, газар тариалангийн эрчимжсэн бүс нутаг болгоно https://t.co/fa3pSKxk4t via @zaluu.com"
negative,"Урлаг &amp; Соёл 

""Голын тохой дээр"" А.Эрдэнэ-Очир 

https://t.co/ajrunpMhzN via @YouTube"
